{
  "$schema": "https://glotfile.dev/schema/v1.json",
  "config": {
    "autoExport": true,
    "format": {
      "finalNewline": true,
      "indent": 2,
      "sortKeys": true
    },
    "locales": [
      "en",
      "de",
      "es",
      "fr",
      "ja",
      "ar",
      "pl"
    ],
    "outputs": [
      {
        "adapter": "i18next-json",
        "path": "src/locales/{locale}.json"
      },
      {
        "adapter": "flutter-arb",
        "path": "lib/l10n/app_{locale}.arb"
      }
    ],
    "sourceLocale": "en",
    "spelling": {
      "customWords": [
        "Glotfile"
      ]
    }
  },
  "glossary": [
    {
      "caseSensitive": true,
      "doNotTranslate": true,
      "notes": "Product name — never translate or inflect.",
      "term": "Acme Drive"
    },
    {
      "doNotTranslate": true,
      "notes": "Plan tier, keep in English.",
      "term": "Pro"
    }
  ],
  "keys": {
    "common.cancel": {
      "values": {
        "en": {
          "state": "source",
          "value": "Cancel"
        },
        "de": {
          "state": "reviewed",
          "value": "Abbrechen"
        },
        "es": {
          "state": "reviewed",
          "value": "Cancelar"
        },
        "fr": {
          "state": "reviewed",
          "value": "Annuler"
        },
        "ja": {
          "state": "reviewed",
          "value": "キャンセル"
        },
        "ar": {
          "state": "reviewed",
          "value": "إلغاء"
        },
        "pl": {
          "state": "reviewed",
          "value": "Anuluj"
        }
      },
      "tags": [
        "common",
        "button"
      ]
    },
    "common.save": {
      "values": {
        "en": {
          "state": "source",
          "value": "Save"
        },
        "de": {
          "state": "reviewed",
          "value": "Speichern"
        },
        "es": {
          "state": "reviewed",
          "value": "Guardar"
        },
        "fr": {
          "state": "reviewed",
          "value": "Enregistrer"
        },
        "ja": {
          "state": "reviewed",
          "value": "保存"
        },
        "ar": {
          "state": "reviewed",
          "value": "حفظ"
        },
        "pl": {
          "state": "reviewed",
          "value": "Zapisz"
        }
      },
      "tags": [
        "common",
        "button"
      ]
    },
    "common.delete": {
      "values": {
        "en": {
          "state": "source",
          "value": "Delete"
        },
        "de": {
          "state": "reviewed",
          "value": "Löschen"
        },
        "es": {
          "source": "ai",
          "state": "machine",
          "value": "Eliminar"
        },
        "fr": {
          "state": "reviewed",
          "value": "Supprimer"
        },
        "ja": {
          "source": "ai",
          "state": "machine",
          "value": "削除"
        },
        "ar": {
          "state": "reviewed",
          "value": "حذف"
        },
        "pl": {
          "state": "reviewed",
          "value": "Usuń"
        }
      },
      "tags": [
        "common",
        "button"
      ]
    },
    "common.confirm": {
      "values": {
        "en": {
          "state": "source",
          "value": "Confirm"
        },
        "de": {
          "state": "reviewed",
          "value": "Bestätigen"
        },
        "es": {
          "state": "reviewed",
          "value": "Confirmar"
        },
        "fr": {
          "state": "reviewed",
          "value": "Confirmer"
        },
        "ja": {
          "state": "reviewed",
          "value": "確認"
        },
        "ar": {
          "source": "ai",
          "state": "machine",
          "value": "تأكيد"
        },
        "pl": {
          "state": "reviewed",
          "value": "Potwierdź"
        }
      },
      "tags": [
        "common",
        "button"
      ]
    },
    "nav.dashboard": {
      "values": {
        "en": {
          "state": "source",
          "value": "Dashboard"
        },
        "de": {
          "state": "reviewed",
          "value": "Übersicht"
        },
        "es": {
          "state": "reviewed",
          "value": "Panel"
        },
        "fr": {
          "state": "reviewed",
          "value": "Tableau de bord"
        },
        "ja": {
          "state": "reviewed",
          "value": "ダッシュボード"
        },
        "ar": {
          "state": "reviewed",
          "value": "لوحة التحكم"
        },
        "pl": {
          "state": "reviewed",
          "value": "Pulpit"
        }
      },
      "tags": [
        "nav"
      ]
    },
    "nav.files": {
      "values": {
        "en": {
          "state": "source",
          "value": "Files"
        },
        "de": {
          "state": "reviewed",
          "value": "Dateien"
        },
        "es": {
          "state": "reviewed",
          "value": "Archivos"
        },
        "fr": {
          "state": "reviewed",
          "value": "Fichiers"
        },
        "ja": {
          "state": "reviewed",
          "value": "ファイル"
        },
        "ar": {
          "state": "reviewed",
          "value": "الملفات"
        },
        "pl": {
          "state": "reviewed",
          "value": "Pliki"
        }
      },
      "tags": [
        "nav"
      ]
    },
    "nav.settings": {
      "values": {
        "en": {
          "state": "source",
          "value": "Settings"
        },
        "de": {
          "state": "reviewed",
          "value": "Einstellungen"
        },
        "es": {
          "state": "reviewed",
          "value": "Ajustes"
        },
        "fr": {
          "state": "reviewed",
          "value": "Paramètres"
        },
        "ja": {
          "state": "reviewed",
          "value": "設定"
        },
        "ar": {
          "state": "reviewed",
          "value": "الإعدادات"
        },
        "pl": {
          "state": "reviewed",
          "value": "Ustawienia"
        }
      },
      "tags": [
        "nav"
      ]
    },
    "files.count": {
      "values": {
        "en": {
          "state": "source",
          "value": "{count, plural, one {# file} other {# files}}"
        },
        "de": {
          "state": "reviewed",
          "value": "{count, plural, one {# Datei} other {# Dateien}}"
        },
        "es": {
          "source": "ai",
          "state": "machine",
          "value": "{count, plural, one {# archivo} other {# archivos}}"
        },
        "fr": {
          "state": "reviewed",
          "value": "{count, plural, one {# fichier} other {# fichiers}}"
        }
      },
      "context": "Count shown above the file list. {count} is the number of files in the current folder.",
      "tags": [
        "files",
        "plural"
      ]
    },
    "files.upload": {
      "values": {
        "en": {
          "state": "source",
          "value": "Upload files"
        },
        "de": {
          "state": "reviewed",
          "value": "Dateien hochladen"
        },
        "es": {
          "state": "reviewed",
          "value": "Subir archivos"
        },
        "fr": {
          "state": "reviewed",
          "value": "Téléverser des fichiers"
        },
        "ja": {
          "source": "ai",
          "state": "machine",
          "value": "ファイルをアップロード"
        },
        "ar": {
          "state": "reviewed",
          "value": "رفع الملفات"
        },
        "pl": {
          "source": "ai",
          "state": "machine",
          "value": "Prześlij pliki"
        }
      },
      "tags": [
        "files",
        "button"
      ]
    },
    "files.uploadProgress": {
      "values": {
        "en": {
          "state": "source",
          "value": "Uploading {count} of {total}…"
        },
        "de": {
          "state": "reviewed",
          "value": "Lade {count} von {total} hoch…"
        },
        "es": {
          "state": "needs-review",
          "value": "Subiendo {count} de {total}…"
        },
        "fr": {
          "state": "reviewed",
          "value": "Téléversement de {count} sur {total}…"
        }
      },
      "context": "Progress label during upload. {count} of {total} files completed.",
      "tags": [
        "files",
        "placeholder"
      ]
    },
    "files.empty": {
      "values": {
        "en": {
          "state": "source",
          "value": "No files yet — drag and drop to upload."
        },
        "de": {
          "state": "reviewed",
          "value": "Noch keine Dateien – zum Hochladen hierher ziehen."
        },
        "es": {
          "source": "ai",
          "state": "machine",
          "value": "Aún no hay archivos: arrastra y suelta para subir."
        },
        "fr": {
          "state": "reviewed",
          "value": "Aucun fichier pour le moment – glissez-déposez pour téléverser."
        }
      },
      "context": "Empty state shown when a folder has no files.",
      "tags": [
        "files"
      ]
    },
    "files.shareLink": {
      "values": {
        "en": {
          "state": "source",
          "value": "Copy share link"
        },
        "de": {
          "state": "reviewed",
          "value": "Freigabelink kopieren"
        },
        "es": {
          "state": "reviewed",
          "value": "Copiar enlace para compartir"
        },
        "fr": {
          "state": "reviewed",
          "value": "Copier le lien de partage"
        },
        "ar": {
          "source": "ai",
          "state": "machine",
          "value": "نسخ رابط المشاركة"
        }
      },
      "tags": [
        "files",
        "button"
      ]
    },
    "account.email.change.confirmed.description": {
      "values": {
        "en": {
          "state": "source",
          "value": "Your email address has been updated successfully. You can now sign in with your new address."
        },
        "de": {
          "source": "ai",
          "state": "machine",